format,example_path,storage_form,logical_document_unit,addressable_location,possible_pii_carriers,expected_write_strategy,input_status,mvp_priority
csv_csv_gz,"DycomData/MIMIC-IV/hosp/admissions.csv","delimited text, sometimes gzip-compressed","row or cell","row plus column cell","IDs, dates and times, provider IDs, free-text columns such as text comments chiefcomplaint field_value result_value","cell-level rewrite while preserving quoting and compression","primary in source trees; derived or reference in annotation trees","high"
txt,"DycomData/Anonymization/deanonymized_with_labels/patient_10005749_20010003/discharge_note_20010003.txt","plain text","note or document","character span line section","names, dates, places, providers, contact details, section headers","no standalone write strategy defined for MVP; use as reference evidence only","derived or reference note export, not primary pipeline input","none"
dcm,"DycomData/Anonymization/original_data/patient_10080695_23273240/echo/91180014_0001.dcm","binary DICOM object","study series or image","DICOM tag or burned-in region","patient name, date of birth, patient ID, institution, physician, accession or study metadata","pending raw-tag validation with pydicom; likely metadata-safe rewrite only in first version","provisional primary in raw bundles; derived or reference in labeled bundles","medium"
hea,"DycomData/MIMIC-IV-ECG-subset/files/p1001/p10010058/s41175005/41175005.hea","ASCII WFDB header","record header","header line or token","record ID, acquisition time or date, subject comment, channel labels","line-preserving header rewrite","primary","low"
dat,"DycomData/MIMIC-IV-ECG-subset/files/p1001/p10010058/s41175005/41175005.dat","binary signal stream","channel sample stream","sample index only theoretically","usually no direct PII beyond record linkage","copy-through in MVP unless signal-domain injection is later required","primary","low"
pdf,"DycomData/Anonymization/deanonymized_without_labels/patient_10005749_20010003/ecg/ecg_Allison_Hill_PID-688508_47646408.pdf","rendered page or graphic","report page","page region or OCR span","patient name, PID, DOB, physician, institution in overlays","regenerate rather than patch in MVP","derived or reference","none"
html,"DycomData/MIMIC-IV-Waveform-subset/files/mimic4wdb/0.1.0/index.html","static HTML listing","directory index page","link entry","no substantive project-relevant PII","leave untouched","auxiliary","none"
records_ds_store,"DycomData/MIMIC-IV-ECG-subset/RECORDS","manifest or OS metadata","none","none","none","ignore or preserve as-is","auxiliary","none"
